{
  "id": "windows-codex-cli-plan",
  "platform": "windows",
  "action": "install-codex-cli",
  "description": "Example future plan for installing Codex CLI on Windows. This file documents intended commands only and must not be auto-executed.",
  "commands": [
    "npm install -g @openai/codex",
    "codex --version"
  ],
  "requiresAdmin": false,
  "riskLevel": "MEDIUM",
  "confirmationRequired": true,
  "rollbackAvailable": false,
  "verificationCommands": [
    "codex --version"
  ],
  "autoExecute": false,
  "notes": [
    "Example only. Do not run without explicit user confirmation in a future installer engine."
  ]
}
